{
  "run_id": "RUN-1110405-CAL006-A",
  "project_id": "1110405",
  "status": "PASS",
  "required_outputs": [
    "C:\\Users\\alex1\\OneDrive\\Documents\\PLC Panels Generation Helper\\evals\\runs\\RUN-1110405-CAL006-A\\generated\\pdfs\\01_生管課用圖_1110405.pdf",
    "C:\\Users\\alex1\\OneDrive\\Documents\\PLC Panels Generation Helper\\evals\\runs\\RUN-1110405-CAL006-A\\generated\\pdfs\\02_鈑金施工圖_1110405.pdf",
    "C:\\Users\\alex1\\OneDrive\\Documents\\PLC Panels Generation Helper\\evals\\runs\\RUN-1110405-CAL006-A\\generated\\pdfs\\03_沖孔施工圖_1110405.pdf"
  ],
  "failure_reason": null
}
