{
  "run_id": "RUN-1110204-CAL006-B",
  "project_id": "1110204",
  "status": "PASS",
  "required_outputs": [
    "C:\\Users\\alex1\\OneDrive\\Documents\\PLC Panels Generation Helper\\evals\\runs\\RUN-1110204-CAL006-B\\generated\\pdfs\\01_生管課用圖_1110204.pdf",
    "C:\\Users\\alex1\\OneDrive\\Documents\\PLC Panels Generation Helper\\evals\\runs\\RUN-1110204-CAL006-B\\generated\\pdfs\\02_鈑金施工圖_1110204.pdf",
    "C:\\Users\\alex1\\OneDrive\\Documents\\PLC Panels Generation Helper\\evals\\runs\\RUN-1110204-CAL006-B\\generated\\pdfs\\03_沖孔施工圖_1110204.pdf"
  ],
  "failure_reason": null
}
